{
  "id": "glitch",
  "game": "gtav",
  "title": {
    "en": "Glitches",
    "fr": "Anomalies",
    "es": "Fallos",
    "it": "Anomalie",
    "de": "Glitches"
  },
  "isChallenge": false,
  "status": "draft",
  "sources": [
    "https://raw.githubusercontent.com/gta5-map/gta5-map.github.io/master/locations.json"
  ]
}
